{
  "contract_id": "https://bill.contracts.local/data-flow-register/1.0",
  "contract_version": "1.0",
  "status": "proposed: F02 submitted, not accepted. This register records no G5 decision. Every retention period for stored personal data is pending_G5; every processor region is unknown until HB-27 is answered. Repair attempt 3 (design review A6D2-02): FL-29 adds the booking-to-contact join (the invitee address as a transient DC-CONTACT matching key, never stored), and DC-BOOKING-INTAKE, FL-06 and FL-15 say so.",
  "registry_schema": ".orchestration/evidence/F02/data/registry-schemas/data-flow-register.registry.schema.json",
  "rules_document": "privacy-boundary.md",
  "sources": ["01 §7, §9, §12, §14", "04 §1-§4, §7", "05 §8", "06 secrets map", "D-014", "D-040", "D-042", "D-051", "inventory §3, §6.4, §7", "docs/INTEGRATIONS.md (codex 66cce52)", "lib/contact.ts (codex 66cce52)"],
  "decision_owner": "The responsible privacy and operations owner at G5 (named through HB-21; decisions asked in HB-27, HB-28). Agents propose; they do not decide retention, processors or consent wording.",
  "data_classes": [
    {"id": "DC-FIN-INPUT", "label": "Workshop financial inputs", "examples": "desired spending, income amounts and their start timing, gross/net basis, savings by tax category, home or business value, current and intended retirement ages, household timing, planning horizon, inflation or return assumptions, the local lifestyle choice", "tier": "browser_only", "allowed_sinks": ["browser_memory", "browser_storage_optin", "browser_local_export"]},
    {"id": "DC-FIN-DERIVED", "label": "Derived workshop results", "examples": "annual gap or surplus, capital illustration, completeness state, selected branch clip, warning or risk selection, chart series, summary text", "tier": "browser_only", "allowed_sinks": ["browser_memory", "browser_storage_optin", "browser_local_export"]},
    {"id": "DC-CONTACT", "label": "Contact identity", "examples": "normalized email, optional first name, chosen locale, internal contact ID, provider contact ID", "tier": "personal", "allowed_sinks": ["app_server", "supabase", "n8n", "brevo", "backups_offhost", "operator_view"]},
    {"id": "DC-CONSENT", "label": "Consent and revocation evidence", "examples": "purpose, granted/requested/revoked, wording version, capture time, capture source, evidence reference", "tier": "personal", "allowed_sinks": ["app_server", "supabase", "brevo", "backups_offhost", "operator_view"]},
    {"id": "DC-OPERATIONAL", "label": "Operational state", "examples": "registrations, attendance state with evidence source, booking references and times, delivery job state, integration event metadata, audit rows", "tier": "personal", "allowed_sinks": ["app_server", "supabase", "n8n", "backups_offhost", "operator_view"]},
    {"id": "DC-EVENT-META", "label": "Event envelope metadata", "examples": "the ten fields of event-envelope 1.0", "tier": "pseudonymous", "allowed_sinks": ["app_server", "supabase", "n8n", "backups_offhost"]},
    {"id": "DC-ORDER", "label": "Order, payment and entitlement references", "examples": "order ID, Stripe session/payment IDs, product version, payment state, fulfilment state, consultation right state", "tier": "personal", "allowed_sinks": ["stripe", "app_server", "supabase", "n8n", "backups_offhost", "operator_view"]},
    {"id": "DC-SHIPPING", "label": "Shipping address", "examples": "name and postal address collected by hosted checkout", "tier": "personal", "allowed_sinks": ["stripe"]},
    {"id": "DC-CARD", "label": "Payment card data", "examples": "card number, expiry, CVC", "tier": "provider_only", "allowed_sinks": ["stripe"]},
    {"id": "DC-BOOKING-INTAKE", "label": "Scheduler intake", "examples": "invitee name and email, any intake answer, chosen time and mode, as the scheduler and calendar hold them. The invitee email reaches the application server only as FL-29's transient matching key, under DC-CONTACT, and is never stored; the name and intake answers never do (privacy-boundary.md PB-CAL-3)", "tier": "personal", "allowed_sinks": ["scheduler", "google_workspace"]},
    {"id": "DC-MEETING-PRESENCE", "label": "Live meeting presence", "examples": "display name, camera, chat, poll answers, recording", "tier": "personal", "allowed_sinks": ["google_workspace"]},
    {"id": "DC-INQUIRY", "label": "Existing inquiry form", "examples": "name, email, topic ID, free-text message, language; HMAC of the IP for rate limiting", "tier": "personal", "allowed_sinks": ["app_server", "resend", "upstash", "mailbox"]},
    {"id": "DC-REPLY", "label": "Inbound replies", "examples": "email replies to a message or to the contact address", "tier": "personal", "allowed_sinks": ["mailbox"]},
    {"id": "DC-TECH", "label": "Technical request data", "examples": "IP address, user agent, request path, timestamps", "tier": "technical", "allowed_sinks": ["app_server", "app_logs", "upstash"]},
    {"id": "DC-VOICE-NOTE", "label": "Bill's non-identifying notes", "examples": "voice-note transcript or notes for the weekly article, with client identifiers removed", "tier": "internal", "allowed_sinks": ["llm_prompt", "github"]},
    {"id": "DC-CONTENT", "label": "Editorial content", "examples": "drafts, approved articles, scripts, approval ledger entries", "tier": "public_or_internal", "allowed_sinks": ["github", "app_server", "llm_prompt"]},
    {"id": "DC-AGGREGATE", "label": "Aggregate metrics", "examples": "counts of jobs, sends, registrations, held meetings; no personal data", "tier": "aggregate", "allowed_sinks": ["operator_view", "alert_channel", "app_logs", "telegram_smoke"]},
    {"id": "DC-SECRET", "label": "Secrets and credentials", "examples": "API keys, webhook secrets, encryption keys, OAuth tokens", "tier": "secret", "allowed_sinks": ["secret_store"]}
  ],
  "sinks": [
    {"id": "browser_memory", "kind": "visitor_device", "processor": null, "status": "proposed", "note": "In-page state; precedent: the codex checklist sends nothing and stores nothing (tests/browser/site.spec.ts)."},
    {"id": "browser_storage_optin", "kind": "visitor_device", "processor": null, "status": "proposed", "note": "localStorage, sessionStorage, IndexedDB or Cache, only after an explicit opt-in."},
    {"id": "browser_local_export", "kind": "visitor_device", "processor": null, "status": "proposed", "note": "window.print or a file generated in the browser; no server round trip."},
    {"id": "app_server", "kind": "internal", "processor": "production host: VPS default or Vercel Pro (HB-01)", "status": "proposed", "note": "Next.js server-only adapters; transient processing."},
    {"id": "app_logs", "kind": "internal", "processor": "production host (HB-01)", "status": "existing", "note": "Hosting and application logs."},
    {"id": "supabase", "kind": "processor", "processor": "Supabase (Free tier, D-020)", "status": "proposed", "note": "Operational store (operational-data-model.md)."},
    {"id": "n8n", "kind": "internal", "processor": "self-hosted n8n on the VPS (D-021)", "status": "proposed", "note": "Execution history in SQLite; minimized (01 §8)."},
    {"id": "brevo", "kind": "processor", "processor": "Brevo (Free, D-023)", "status": "proposed", "note": "Delivery and blocklist signals."},
    {"id": "stripe", "kind": "processor", "processor": "Stripe hosted checkout (D-025)", "status": "proposed", "note": "Payment truth."},
    {"id": "scheduler", "kind": "processor", "processor": "Calendly (existing, D-062); Google appointment schedules as candidate (D-024)", "status": "existing", "note": "Provider-held booking data."},
    {"id": "google_workspace", "kind": "processor", "processor": "Google Calendar and Meet on Bill's account (edition unknown, HB-14)", "status": "proposed", "note": ""},
    {"id": "analytics_ads", "kind": "processor", "processor": "none selected; Meta only if paid_ads is enabled (no Bill account visible, D-056)", "status": "forbidden_until_flag", "note": "third_party_tracking and paid_ads default false."},
    {"id": "error_monitoring", "kind": "processor", "processor": "none selected", "status": "not_selected", "note": "Adding one needs a new contract version and G5."},
    {"id": "url", "kind": "channel", "processor": null, "status": "existing", "note": "Any URL path, query string or fragment, including links in emails and redirects."},
    {"id": "cookies", "kind": "channel", "processor": null, "status": "existing", "note": "The site sets no visitor cookies today (docs/INTEGRATIONS.md)."},
    {"id": "llm_prompt", "kind": "processor", "processor": "approved model environment for the weekly draft only; none selected; paid API budget 0 (D-027, D-064)", "status": "not_selected", "note": ""},
    {"id": "github", "kind": "processor", "processor": "GitHub repository arnaudverdier8-svg/bill (private)", "status": "existing", "note": "Content, approval ledger, code."},
    {"id": "backups_offhost", "kind": "processor", "processor": "off-host encrypted backup storage, not selected (HB-10)", "status": "proposed", "note": ""},
    {"id": "operator_view", "kind": "internal", "processor": "authenticated operations view (U05)", "status": "proposed", "note": ""},
    {"id": "alert_channel", "kind": "processor", "processor": "operator alert channel, not selected (HB-10)", "status": "proposed", "note": ""},
    {"id": "telegram_smoke", "kind": "processor", "processor": "Telegram bot for SM02 smoke tests only; bot and chat not chosen (HB-09b)", "status": "proposed", "note": ""},
    {"id": "resend", "kind": "processor", "processor": "Resend (existing inquiry adapter, disabled by default; retirement open HB-06)", "status": "existing", "note": "lib/contact.ts"},
    {"id": "upstash", "kind": "processor", "processor": "Upstash Redis (existing rate limit, disabled by default; retirement open HB-06)", "status": "existing", "note": "Stores only an HMAC of the IP with a 600 s expiry."},